#CODE;ENGLISH;FRENCH;GERMAN;;SPANISH;;;;;;;;;x
NOMAD_HORSE_OFFENSIVE_MODIFIER;Capital is in a Steppe, Desert or Plains province;La capitale se trouve dans une province de steppes, déserts ou plaines;Hauptstadt in einer Provinz mit Steppe, Wüste oder Ebene;;La capital está en una provincia de estepa, desierto o llanura;;;;;;;;;x
NOMAD_HORSE_DEFENSIVE_MODIFIER;Capital is in a Mountains, Hills or Arctic province;La capitale se trouve dans une province de montagnes, collines ou arctique;Hauptstadt in einer Provinz mit Bergen, Hügeln oder Arktis;;La capital está en unas provincia de montañas, colinas o ártica;;;;;;;;;x
MODIFIER_GLOBAL_WINTER_SUPPLY;Global Winter Supply;Total des vivres d'hivernage;Globales Versorgungslimit (Winter);;Suministro de invierno global;;;;;;;;;x
BUILDING_ACTIVE;This building is only active while;Ce bâtiment n'est actif que si;Dieses Gebäude ist nur aktiv während;;Este edificio sólo está activo mientras;;;;;;;;;x
CAPITAL_AT_HOLY_SITE;Capital at $RELIGION$ Holy Site: §G+$VALUE$§!;Capitale dans un site sacré $RELIGION$ : §G+$VALUE$§!;Hauptstadt in Region mit heiliger Stätte ($RELIGION$): §G+$VALUE$§!;;Capital en el lugar sagrado de $RELIGION$: §G+$VALUE$§!;;;;;;;;;x
COMMANDER_LIMIT;Commander Limit: §Y$LIMIT$§!;Limite de commandants : §Y$LIMIT$§!;Kommandantenlimit: §Y$LIMIT$§!;;Límite de comandante:;;;;;;;;;x
RULER_HAS_MOVED_CAPITAL_RECENTLY;§Y[GetTitledFirstName]§! is not allowed to move the capital again in $MONTHS$ months - unless it's back to the traditional capital of [PrimaryTitle.GetName].;§Y[GetTitledFirstName]§! ne pourra déplacer la capitale à nouveau dans $MONTHS$ mois, à moins de la rétablir dans son emplacement traditionnel.;§Y[GetTitledFirstName]§! darf $MONTHS$ Monate lang die Hauptstadt nicht mehr verlegen. Ausnahme ist die Verlegung zurück zur traditionellen Hauptstadt von [PrimaryTitle.GetName].;;§Y[GetTitledFirstName]§! no tiene permiso para trasladar la capital otra vez en $MONTHS$ meses - a menos que sea de vuelta a la capital tradicional de [PrimaryTitle.GetName].;;;;;;;;;x
CONFIRM_MAKE_CAPITAL_DESC;Are you sure you want to move your court to $PROVINCE$, making it your capital?;Souhaitez-vous vraiment transférer la Cour en $PROVINCE$ et en faire votre capitale ?;Seid Ihr sicher, dass Ihr Euren Hof nach $PROVINCE$ verlegen und diese Provinz zur Hauptstadt machen möchtet?;;¿Estás seguro de que deseas mover la corte a $PROVINCIA$, lo que la convertirá en la capital?;;;;;;;;;x
CONFIRM_MAKE_CAPITAL_DESC_0;$GOVERNMENT$ Rulers can only do this once in their lifetime.;Sous le régime $GOVERNMENT$, ce transfert est irrémédiable du vivant du dirigeant.;Herrscher der Staatsform $GOVERNMENT$ können dies zu Lebzeiten nur einmal tun.;;$GOVERNMENT$ los gobernantes sólo pueden hacer esto una vez en su vida.;;;;;;;;;x
CONFIRM_MAKE_CAPITAL_DESC_1;You will not be able to change capital again for $MONTHS$ months.;Vous ne pourrez pas déplacer la capitale avant §Y$MONTHS$§! mois.;Ihr werdet die Hauptstadt im Anschluss $MONTHS$ Monate nicht mehr ändern können.;;No serás capaz de cambiar la capital otra vez en $MONTHS$ meses.;;;;;;;;;x
NOMAD_CANNOT_MOVE_CAPITAL_TO_HOLDING;Nomads can only move their Capital to provinces with an empty primary holding slot.;Les nomades ne peuvent déplacer leur capitale que dans une province dont le fief principal est vacant.;Nomaden können ihre Hauptstadt nur in Provinzen verlegen, deren primärer Bauplatz leer ist.;;Los nómadas sólo pueden mover su capital a provincias con un hueco vacío de posesión primaria.;;;;;;;;;x
#MANPOWER_BREAKDOWN;Manpower Breakdown;Répartition des effectifs;Aufschlüsselung Mannstärke;;Colapso de la mano de obra;;;;;;;;;x
INTERACTION_REQUIRES_RECIPIENT_NO_OCCUPIED_PROVINCES;[Recipient.GetBestName] have no occupied provinces.;[Recipient.GetBestName] ne possède aucune province occupée.;[Recipient.GetBestName] hat keine besetzten Provinzen;;[Recipient.GetBestName] no tiene provincias ocupadas;;;;;;;;;x
MAKE_CONSORT_INTERACTION_LONG_DESC;You can have up to three concubines in addition to your wife. Concubines are not truly married, but will bear their liege's legitimate children. A woman who is the prisoner of a ruler can be forced to become his concubine, even if she is already married.;Vous pouvez avoir jusqu'à trois concubines en plus de votre femme. Les concubines ne sont pas réellement mariées, mais elles porteront les enfants légitimes de leur seigneur. Un souverain peut contraindre une prisonnière à devenir sa concubine même si celle-ci est déjà mariée.;Zusätzlich zu Eurer Gattin könnt Ihr bis zu drei Konkubinen haben. Konkubinen werden nicht offiziell geheiratet, doch ihre Kinder gelten als rechtmäßige Nachkommen ihres Herrn. Eine Frau, die in Gefangenschaft geraten ist, kann ins Konkubinat gezwungen werden, selbst wenn sie bereits verheiratet ist.;;Puedes tener hasta tres concubinas además de tu esposa. Las concubinas no están realmente casadas, pero tendrán hijos legítimos de su señor. Una mujer que sea prisionera de un gobernante puede ser obligada a convertirse en su concubina, incluso si ya está casada.;;;;;;;;;x
faction_overthrow;Overthrow Khan;Renverser le khan;Khan stürzen;;Derrocar al kan;;;;;;;;;x
faction_overthrow_title;Overthrow Khan;Renverser le khan;Khan stürzen;;Derrocar al kan;;;;;;;;;x
faction_overthrow_desc;Members desire §Y[From.GetBestName]§! as the new leader for the §Y[This.GetFullName]§!. When sufficiently powerful, §Y[From.GetBestName]§! may present an ultimatum to §Y[From.Liege.GetBestName]§!;Les membres désirent avoir §Y[From.GetBestName]§! comme nouveau chef des §Y[This.GetFullName]§!. Lorsqu'il sera assez puissant, §Y[From.GetBestName]§! pourra présenter un ultimatum à §Y[From.Liege.GetBestName]§!;Mitglieder wünschen, §Y[From.GetBestName]§! zum neuen Anführer der §Y[This.GetFullName]§! zu machen. Sobald §Y[From.GetBestName]§! mächtig genug ist, kann §Y[From.Liege.GetBestName]§! ein Ultimatum gestellt werden.;;Los miembros desean a §Y[From.GetBestName]§! como nuevo líder de §Y[This.GetFullName]§!. ¡Cuando sea lo suficientemente poderoso, §Y[From.GetBestName]§! puede presentar un ultimátum a §Y[From.Liege.GetBestName]§!;;;;;;;;;x
#CB_NAME_INSTALLKHAN;Install $ATTACKER$ as Khan of $SECOND$;Faire de $ATTACKER$ le khan des $SECOND$;$ATTACKER$ als Khan von $SECOND$ einsetzen;;Instalar a $ATTACKER$ como kan de $SECOND$;;;;;;;;;x
WAR_NAME_INSTALLKHAN;Install $ATTACKER$ as Khan of $SECOND$;Faire de $ATTACKER$ le khan des $SECOND$;$ATTACKER$ als Khan von $SECOND$ einsetzen;;Instalar a $ATTACKER$ como kan de $SECOND$;;;;;;;;;x
IMPRISON_INTERACTION_FORCED;Because of their different way of governance, none of your Clans will object to the imprisonment of this outsider.;En raison des différences de gouvernances de vos clans, aucun clan ne s'opposera à l'emprisonnement de cet étranger.;Aufgrund der Unterschiede in der Verwaltung wird keiner Eurer Klans Einwände gegen die Einkerkerung dieses Fremdlings erheben.;;A causa de su diferente modo de gobernar, ninguno de sus clanes se opondrá al encarcelamiento de este forastero.;;;;;;;;;x
EXECUTE_INTERACTION_FORCED;Because of their different way of governance, none of your Clans will object to the execution of this outsider.;En raison des différences de gouvernances de vos clans, aucun clan ne s'opposera à l'exécution de cet étranger.;Aufgrund der Unterschiede in der Verwaltung wird keiner Eurer Klans Einwände gegen die Hinrichtung dieses Fremdlings erheben.;;A causa de su diferente modo de gobernar, ninguno de sus clanes se opondrá a la ejecución de este forastero.;;;;;;;;;x
EXILE_INTERACTION_FORCED;Because of their different way of governance, none of your Clans will object to the exile of this outsider.;En raison des différences de gouvernances de vos clans, aucun clan ne s'opposera à l'exil de cet étranger.;Aufgrund der Unterschiede in der Verwaltung wird keiner Eurer Klans Einwände gegen die Verbannung dieses Fremdlings erheben.;;A causa de su diferente modo de gobernar, ninguno de sus clanes se opondrá al exilio de este forastero.;;;;;;;;;x
#;;;;;;;;;;;;;;x
