#CODE;ENGLISH;FRENCH;GERMAN;;SPANISH;;;;;;;;;x
EVTDESC_RoI_10011;My [GetFromRelation] [From.GetFirstName], [From.Reincarnation.GetTitledFirstName] reborn, is acting more like [From.GetPossPronoun] previous incarnation every day! [From.GetFirstName] is definitely expressing another of [From.Reincarnation.GetFirstName]'s personality traits...;Notre [GetFromRelation] [From.GetFirstName], réincarnation de [From.Reincarnation.GetTitledFirstName], se comporte chaque jour davantage comme sa précédente incarnation ! [From.GetFirstName] est clairement en train d'exprimer un autre aspect de sa personnalité;Mein [GetFromRelation] [From.GetFirstName], die Wiedergeburt von [From.Reincarnation.GetTitledFirstName], verhält sich mehr und mehr wie [From.GetPossPronoun] vorherige Inkarnation! [From.GetFirstName] legt definitiv ein weiteres Persönlichkeitsmerkmal vo;; Mi [GetFromRelation] [From.GetFirstName], [From.Reincarnation.GetTitledFirstName] renacido, está actuando cada día más más como [From.GetPossPronoun] encarnación anterior.  [From.GetFirstName] está sin duda expresando otra de [From.Reincarnation.GetFirstName] características de personalidad ...;;;;;;;;;x
form_the_hre_desc;With a realm to rival that of Charlemagne, I could be recognized as his true successor and, invoking Translatio Imperii, have [Root.RelHead.GetBestName] crown me Emperor of a new Roman Empire in the west!;Si j'avais un royaume rivalisant avec celui de Charlemagne, on pourrait me reconnaître comme son véritable successeur. En invoquant le principe de Translatio Imperii, je pourrai faire en sorte que [Root.RelHead.GetBestName] me couronne empereur d'un nouvel Empire romain d'Occident !;Mit einem Reich, das dem von Karl dem Großen gleichkommt, könnte ich als sein wahrer Nachfolger gelten und mich durch die Anrufung der Translatio Imperii von [Root.RelHead.GetBestName] zum Kaiser des neuen Römischen Imperiums des Westens krönen lassen!;; Con un reino para rivalizar con el de Carlomagno, yo podría ser reconocido como su verdadero sucesor e, invocando a Translatio Imperii, que [Root.RelHead.GetBestName] me corone emperador de un Nuevo Imperio Romano en el oeste!;;;;;;;;;x
THREAT_ADVENTURER;Preparing an Adventure against me;Se prépare à l'aventure contre moi;Bereiten ein Abenteuer gegen mich vor;;Preparando una aventura contra mí;;;;;;;;;x
THREAT_PREPARING_INVASION;Preparing an Invasion against me;Planifie l'invasion de mes terres;Bereiten eine Invasion gegen mich vor;;Preparando una invasión contra mí;;;;;;;;;x
GRANT_LANDED_TITLE_CORRECT_CASTE;Character has the Correct Caste;Le personnage est de la bonne caste;Setzt diesen Charakter als Euren Erben ein;; Nombra a este personaje como tu heredero;;;;;;;;;x
DESIGNATE_HEIR;Designate this Character as your Heir;Désigner ce personnage en tant qu'héritier;Charakter verfügt über die richtige Kaste;;El personaje tiene la Casta Correcta;;;;;;;;;x
HIRE_ORDER_DESC;Hire §Y$TITLE$§W for §Y$COST$§W $PIETYNAME$. (They will arrive in or nearby §Y$CAPITAL$§W.);Engagez §Y$TITLE$§W pour §Y$COST$§W en $PIETYNAME$. (L’arrivée se fera à §Y$CAPITAL$§W ou à proximité).;§Y$TITLE$§W für §Y$COST$§W $PIETYNAME$ anwerben. (Sie treffen in oder nahe §Y$CAPITAL$§W ein.);;Alquilar §Y$TITLE$§W por §Y$COST$§W $PIETYNAME$. (Llegarán a §Y$CAPITAL$§W o cerca.);;;;;;;;;x
expel_the_jomsvikings_desc;I can drive the Knights Templar from my realm and seize their castles. However, it is a very impious thing to do...;Je peux expulser les Jomsvikings de mon territoire et prendre possession de leurs châteaux. Ce serait par contre un acte très impie...;Ich kann die Jomswikinger aus meinem Reich vertreiben und mir ihre Burgen aneignen. Das ist jedoch eine sehr unfromme Tat...;;Puedo echar a los Jomsvikings de mi reino y apoderarme de sus castillos. Sin embargo, es una acción muy impía...;;;;;;;;;x
